[
  {
    "id": "sign-profile-aries",
    "scope": "natal",
    "topic": "sign-profile",
    "sign_id": "aries",
    "title": "Aries – Sign Profile",
    "summary": "Core themes and style of Aries.",
    "markdown": "**Aries** expresses its element and modality through characteristic motivations and tactics. Use this as a neutral baseline; actual charts modulate by house, aspects, and sect.",
    "source_ids": [],
    "tags": [
      "psychological"
    ],
    "confidence": "low"
  },
  {
    "id": "sign-profile-taurus",
    "scope": "natal",
    "topic": "sign-profile",
    "sign_id": "taurus",
    "title": "Taurus – Sign Profile",
    "summary": "Core themes and style of Taurus.",
    "markdown": "**Taurus** expresses its element and modality through characteristic motivations and tactics. Use this as a neutral baseline; actual charts modulate by house, aspects, and sect.",
    "source_ids": [],
    "tags": [
      "psychological"
    ],
    "confidence": "low"
  },
  {
    "id": "sign-profile-gemini",
    "scope": "natal",
    "topic": "sign-profile",
    "sign_id": "gemini",
    "title": "Gemini – Sign Profile",
    "summary": "Core themes and style of Gemini.",
    "markdown": "**Gemini** expresses its element and modality through characteristic motivations and tactics. Use this as a neutral baseline; actual charts modulate by house, aspects, and sect.",
    "source_ids": [],
    "tags": [
      "psychological"
    ],
    "confidence": "low"
  },
  {
    "id": "sign-profile-cancer",
    "scope": "natal",
    "topic": "sign-profile",
    "sign_id": "cancer",
    "title": "Cancer – Sign Profile",
    "summary": "Core themes and style of Cancer.",
    "markdown": "**Cancer** expresses its element and modality through characteristic motivations and tactics. Use this as a neutral baseline; actual charts modulate by house, aspects, and sect.",
    "source_ids": [],
    "tags": [
      "psychological"
    ],
    "confidence": "low"
  },
  {
    "id": "sign-profile-leo",
    "scope": "natal",
    "topic": "sign-profile",
    "sign_id": "leo",
    "title": "Leo – Sign Profile",
    "summary": "Core themes and style of Leo.",
    "markdown": "**Leo** expresses its element and modality through characteristic motivations and tactics. Use this as a neutral baseline; actual charts modulate by house, aspects, and sect.",
    "source_ids": [],
    "tags": [
      "psychological"
    ],
    "confidence": "low"
  },
  {
    "id": "sign-profile-virgo",
    "scope": "natal",
    "topic": "sign-profile",
    "sign_id": "virgo",
    "title": "Virgo – Sign Profile",
    "summary": "Core themes and style of Virgo.",
    "markdown": "**Virgo** expresses its element and modality through characteristic motivations and tactics. Use this as a neutral baseline; actual charts modulate by house, aspects, and sect.",
    "source_ids": [],
    "tags": [
      "psychological"
    ],
    "confidence": "low"
  },
  {
    "id": "sign-profile-libra",
    "scope": "natal",
    "topic": "sign-profile",
    "sign_id": "libra",
    "title": "Libra – Sign Profile",
    "summary": "Core themes and style of Libra.",
    "markdown": "**Libra** expresses its element and modality through characteristic motivations and tactics. Use this as a neutral baseline; actual charts modulate by house, aspects, and sect.",
    "source_ids": [],
    "tags": [
      "psychological"
    ],
    "confidence": "low"
  },
  {
    "id": "sign-profile-scorpio",
    "scope": "natal",
    "topic": "sign-profile",
    "sign_id": "scorpio",
    "title": "Scorpio – Sign Profile",
    "summary": "Core themes and style of Scorpio.",
    "markdown": "**Scorpio** expresses its element and modality through characteristic motivations and tactics. Use this as a neutral baseline; actual charts modulate by house, aspects, and sect.",
    "source_ids": [],
    "tags": [
      "psychological"
    ],
    "confidence": "low"
  },
  {
    "id": "sign-profile-sagittarius",
    "scope": "natal",
    "topic": "sign-profile",
    "sign_id": "sagittarius",
    "title": "Sagittarius – Sign Profile",
    "summary": "Core themes and style of Sagittarius.",
    "markdown": "**Sagittarius** expresses its element and modality through characteristic motivations and tactics. Use this as a neutral baseline; actual charts modulate by house, aspects, and sect.",
    "source_ids": [],
    "tags": [
      "psychological"
    ],
    "confidence": "low"
  },
  {
    "id": "sign-profile-capricorn",
    "scope": "natal",
    "topic": "sign-profile",
    "sign_id": "capricorn",
    "title": "Capricorn – Sign Profile",
    "summary": "Core themes and style of Capricorn.",
    "markdown": "**Capricorn** expresses its element and modality through characteristic motivations and tactics. Use this as a neutral baseline; actual charts modulate by house, aspects, and sect.",
    "source_ids": [],
    "tags": [
      "psychological"
    ],
    "confidence": "low"
  },
  {
    "id": "sign-profile-aquarius",
    "scope": "natal",
    "topic": "sign-profile",
    "sign_id": "aquarius",
    "title": "Aquarius – Sign Profile",
    "summary": "Core themes and style of Aquarius.",
    "markdown": "**Aquarius** expresses its element and modality through characteristic motivations and tactics. Use this as a neutral baseline; actual charts modulate by house, aspects, and sect.",
    "source_ids": [],
    "tags": [
      "psychological"
    ],
    "confidence": "low"
  },
  {
    "id": "sign-profile-pisces",
    "scope": "natal",
    "topic": "sign-profile",
    "sign_id": "pisces",
    "title": "Pisces – Sign Profile",
    "summary": "Core themes and style of Pisces.",
    "markdown": "**Pisces** expresses its element and modality through characteristic motivations and tactics. Use this as a neutral baseline; actual charts modulate by house, aspects, and sect.",
    "source_ids": [],
    "tags": [
      "psychological"
    ],
    "confidence": "low"
  },
  {
    "id": "house-profile-house-1",
    "scope": "natal",
    "topic": "house-profile",
    "house_id": "house-1",
    "title": "First House – House Profile",
    "summary": "Topics associated with the first house.",
    "markdown": "The **First House** addresses its topical areas (see `life_domains`). Interpretation varies by house ruler, planets present, aspects to the house ruler, and the sign on the cusp.",
    "source_ids": [],
    "tags": [
      "traditional",
      "psychological"
    ],
    "confidence": "low"
  },
  {
    "id": "house-profile-house-2",
    "scope": "natal",
    "topic": "house-profile",
    "house_id": "house-2",
    "title": "Second House – House Profile",
    "summary": "Topics associated with the second house.",
    "markdown": "The **Second House** addresses its topical areas (see `life_domains`). Interpretation varies by house ruler, planets present, aspects to the house ruler, and the sign on the cusp.",
    "source_ids": [],
    "tags": [
      "traditional",
      "psychological"
    ],
    "confidence": "low"
  },
  {
    "id": "house-profile-house-3",
    "scope": "natal",
    "topic": "house-profile",
    "house_id": "house-3",
    "title": "Third House – House Profile",
    "summary": "Topics associated with the third house.",
    "markdown": "The **Third House** addresses its topical areas (see `life_domains`). Interpretation varies by house ruler, planets present, aspects to the house ruler, and the sign on the cusp.",
    "source_ids": [],
    "tags": [
      "traditional",
      "psychological"
    ],
    "confidence": "low"
  },
  {
    "id": "house-profile-house-4",
    "scope": "natal",
    "topic": "house-profile",
    "house_id": "house-4",
    "title": "Fourth House – House Profile",
    "summary": "Topics associated with the fourth house.",
    "markdown": "The **Fourth House** addresses its topical areas (see `life_domains`). Interpretation varies by house ruler, planets present, aspects to the house ruler, and the sign on the cusp.",
    "source_ids": [],
    "tags": [
      "traditional",
      "psychological"
    ],
    "confidence": "low"
  },
  {
    "id": "house-profile-house-5",
    "scope": "natal",
    "topic": "house-profile",
    "house_id": "house-5",
    "title": "Fifth House – House Profile",
    "summary": "Topics associated with the fifth house.",
    "markdown": "The **Fifth House** addresses its topical areas (see `life_domains`). Interpretation varies by house ruler, planets present, aspects to the house ruler, and the sign on the cusp.",
    "source_ids": [],
    "tags": [
      "traditional",
      "psychological"
    ],
    "confidence": "low"
  },
  {
    "id": "house-profile-house-6",
    "scope": "natal",
    "topic": "house-profile",
    "house_id": "house-6",
    "title": "Sixth House – House Profile",
    "summary": "Topics associated with the sixth house.",
    "markdown": "The **Sixth House** addresses its topical areas (see `life_domains`). Interpretation varies by house ruler, planets present, aspects to the house ruler, and the sign on the cusp.",
    "source_ids": [],
    "tags": [
      "traditional",
      "psychological"
    ],
    "confidence": "low"
  },
  {
    "id": "house-profile-house-7",
    "scope": "natal",
    "topic": "house-profile",
    "house_id": "house-7",
    "title": "Seventh House – House Profile",
    "summary": "Topics associated with the seventh house.",
    "markdown": "The **Seventh House** addresses its topical areas (see `life_domains`). Interpretation varies by house ruler, planets present, aspects to the house ruler, and the sign on the cusp.",
    "source_ids": [],
    "tags": [
      "traditional",
      "psychological"
    ],
    "confidence": "low"
  },
  {
    "id": "house-profile-house-8",
    "scope": "natal",
    "topic": "house-profile",
    "house_id": "house-8",
    "title": "Eighth House – House Profile",
    "summary": "Topics associated with the eighth house.",